EJERCICIO;GASTO/INGRESO;CAPITULO;ARTICULO;CONCEPTO;SUBCONCEPTO;DESCRIPCION CORTA;DESCRIPCION LARGA
2017;G;4;49;490/27006;;;Contribuciones a Instituciones Financieras Multilaterales
2017;G;4;49;490/27009;;;Subvención a las Cámaras de Comercio en el extranjero
2017;G;4;49;490/27011;;;Al Instituto de Astrofísica de Canarias
2017;G;4;49;490/27014;;;Gastos de participación en centros o programas internacionales de investigación y cuotas
2017;G;4;49;490/27016;;;Contribución de España al presupuesto del Comité del Acero de la OCDE
2017;G;4;49;490/27102;;;Al Foro Internacional de Organismos Supervisores de Auditoría (IFIAR)
2017;G;4;49;490/27302;;;Cuotas a organismos internacionales
2017;G;4;49;490/60001;;;Al Exterior
2017;G;4;49;491/12001;;;A la Basílica de Santa María la Mayor de Roma (Óbolo Regio)
2017;G;4;49;491/13001;;;Conferencia de Ministros de Justicia de Países Iberoamericanos
2017;G;4;49;491/13101;;;Cuotas y aportaciones Organismos Internacionales
2017;G;4;49;491/15005;;;Aportación a la  OCDE para la financiación del Foro Global sobre Transparencia e Intercambio de Información Tributaria
2017;G;4;49;491/15102;;;Cuota anual a la Organización Iberoaméricana de Cooperación Intermunicipal (O.I.C.I.).
2017;G;4;49;491/16002;;;Contribución a Organismos Internacionales
2017;G;4;49;491/16003;;;Contribución a Organismos Internacionales
2017;G;4;49;491/16004;;;Cuotas a Organismos Internacionales
2017;G;4;49;491/16005;;;A la Organización Europea de Servicios Penitenciarios y Correccionales (EUROPRIS)
2017;G;4;49;491/16101;;;Cuotas y contribuciones a Organismos Internacionales
2017;G;4;49;491/17018;;;Cuotas a Organismos Internacionales
2017;G;4;49;491/17032;;;Cuotas a Organismos Internacionales
2017;G;4;49;491/18008;;;Cuotas a organismos internacionales y participación en programas educativos o culturales
2017;G;4;49;491/18011;;;Cuotas a organismos internacionales y para proyectos de cooperación internacional
2017;G;4;49;491/18102;;;Al exterior- Programa Paulo Freire de movilidad académica para estudiantes de programas universitarios en formación
2017;G;4;49;491/18107;;;Aportación a actividad de la OEI-Iberescena para el Programa Iberescena
2017;G;4;49;491/19001;;;Aportaciones para realización de programas y otros
2017;G;4;49;491/19101;;;Cuotas a la Asociación Mundial de los Servicios Públicos de Empleo (AMSPE) y otras organizaciones internacionales
2017;G;4;49;491/19104;;;Cuotas AISS (Asociación Internacional Seguridad Social)
2017;G;4;49;491/20004;;;Cuota a la Organización Mundial del Turismo
2017;G;4;49;491/20104;;;Cuotas a la European Travel Commission (ETC)
2017;G;4;49;491/23004;;;Estudios y actuaciones en materia de cambio climático en el ámbito de la Unión Europea
2017;G;4;49;491/23101;;;Programa de cooperación internacional
2017;G;4;49;491/23110;;;Instituto Mediterráneo del Agua
2017;G;4;49;491/26002;;;Aportación a organismos y programas internacionales
2017;G;4;49;491/26007;;;A la Oficina de la Organización Mundial de la Salud
2017;G;4;49;491/26101;;;Cuotas a Organismos Internacionales
2017;G;4;49;491/27004;;;Contribución al Centro BRUEGEL
2017;G;4;49;491/27006;;;Contribución al Foro Global de Productividad OCDE
2017;G;4;49;491/27101;;;Cuotas a organismos internacionales
2017;G;4;49;491/27102;;;Al European Financial Reporting Advisory Group (EFRAG)
2017;G;4;49;491/27103;;;Contribuciones a organismos de la Agencia Internacional de la Energía
2017;G;4;49;491/27106;;;Cuotas y contribuciones a organismos internacionales
2017;G;4;49;491/27107;;;Cuotas y convenios internacionales
2017;G;4;49;491/27109;;;Cuotas de participación en EURAMET (Organización Regional de Metrología Europea)
2017;G;4;49;491/27401;;;Cuotas y contribuciones a organismos internacionales y entidades sin fines de lucro
2017;G;4;49;491/34001;;;Aportación a la Unión Europea por recurso propio procedente del IVA
2017;G;4;49;492/12401;;;Entidades culturales en el exterior
2017;G;4;49;492/13001;;;Cuota al Instituto de las Naciones Unidas para la prevención del delito y tratamiento del delincuente
2017;G;4;49;492/17001;;;Cuotas a Organismos Internacionales
2017;G;4;49;492/17034;;;Cuotas a Organismos Internacionales
2017;G;4;49;492/17039;;;Cuotas a Organismos Internacionales
2017;G;4;49;492/17101;;;Cuotas a Organismos Internacionales
2017;G;4;49;492/18005;;;Cuotas a organismos internacionales y participación en programas educativos o culturales
2017;G;4;49;492/18104;;;Pago de cuotas de las asociaciones internacionales a las que pertenece la BNE
2017;G;4;49;492/18401;;;Contribución a la Agencia Mundial Antidopaje (AMA)
2017;G;4;49;492/19007;;;Prestaciones por razón de necesidad y otras ayudas para emigrantes
2017;G;4;49;492/19101;;;Cuota PIACC y otras contribuciones a la OCDE
2017;G;4;49;492/19104;;;Subvención para la Agencia Europea para la Seguridad y Salud en el Trabajo
2017;G;4;49;492/20012;;;Para abonar las cuotas que se deriven del acuerdo firmado con el Instituto Europeo de Normas de Telecomunicaciones y (ETSI) y Digital Video Broadcasting (DVB)
2017;G;4;49;492/20019;;;Contribución de España al Grupo Internacional de Estudios del Cobre
2017;G;4;49;492/20102;;;Cuotas a asociaciones y participación en organismos internacionales
2017;G;4;49;492/23101;;;Cuota a la red de gestores de áreas marinas protegidas del Mediterráneo (MedPAN)
2017;G;4;49;492/23110;;;Red Internacional de Organismos de Cuenca
2017;G;4;49;492/26002;;;Para todos los gastos que ocasione la cooperación sanitaria internacional
2017;G;4;49;492/26018;;;Programas de cooperación internacional en aplicación de la Ley 17/2003
2017;G;4;49;492/26101;;;A la Organización Iberoamericana de Juventud para los gastos de funcionamiento previstos en el Convenio entre España y esta organización internacional
2017;G;4;49;492/26108;;;Convenio con la UJSario
2017;G;4;49;492/26401;;;Pharmaceutical Inspection Convention
2017;G;4;49;492/27004;;;Contribución al Grupo de Acción Financiera Internacional contra el Blanqueo de Capitales
2017;G;4;49;492/27016;;;Contribución de España al Presupuesto del Foro Mundial exceso de capacidad del acero . G20
2017;G;4;49;492/27103;;;Contribución voluntaria a la Organización Internacional de la Energía Atómica (OIEA)
2017;G;4;49;492/27104;;;Cuotas y gastos derivados de la participación española en otros organismos internacionales
2017;G;4;49;492/27105;;;Pago de cuotas a organismos internacionales
2017;G;4;49;492/27109;;;Cuotas de participación en WELMEC. (Cooperación Europea en Metrología Legal)
2017;G;4;49;492/34001;;;Aportación a la Unión Europea por recurso propio basado en la Renta Nacional Bruta (RNB)
2017;G;4;49;493/12001;;;Protección de españoles en el extranjero: asistencia social, evacuaciones, hospitalizaciones y repatriaciones
2017;G;4;49;493/12401;;;Participación en Organismos Internacionales
2017;G;4;49;493/13001;;;GRECO - Grupo de Estados contra la Corrupción
2017;G;4;49;493/15008;;;Cuota a EUROGEOGRAPHICS
2017;G;4;49;493/15014;;;Aportación española al Programa de Cooperación Interregional INTERREG Europe 2014-2020
2017;G;4;49;493/15102;;;Al Instituto Europeo de Administración Pública
2017;G;4;49;493/17003;;;Cuotas a Organismos Internacionales
2017;G;4;49;493/18004;;;Cuotas a organismos internacionales y participación en programas educativos o culturales
2017;G;4;49;493/18006;;;Al Colegio de España en París para ayuda a sus gastos de funcionamiento
2017;G;4;49;493/18008;;;A la Organización de Estados Iberoamericanos para la Educación, la Ciencia y la Cultura (OEI) para financiación y desarrollo de actividades
2017;G;4;49;493/19101;;;Cuota anual CINTERFOR-OIT, incluso obligaciones de ejercicios anteriores
2017;G;4;49;493/19104;;;Cuotas OISS (Organización Iberoamericana Seguridad Social)
2017;G;4;49;493/20012;;;Para satisfacer las obligaciones que se deriven para España de nuestra participación en la Oficina Europea de Comunicaciones (ECO)
2017;G;4;49;493/20018;;;Carta de la Energía
2017;G;4;49;493/23401;;;Participación en el Grupo de Cooperacion HIRLAM. Proyecto para el desarrollo de un modelo numérico de previsión meteorológica a corto plazo.
2017;G;4;49;493/26108;;;Convenio con la Organización Iberoamericana de Juventud y el Foro Latinoamericano de Juventud
2017;G;4;49;493/27004;;;Contribución de España a los gastos de gestión de su oficina de representación conjunta ante el FMI
2017;G;4;49;493/27109;;;Cuotas de participación en IMEKO (Confederación Internacional de Medida)
2017;G;4;49;493/34001;;;Aportación a la Unión Europea por la recaudación líquida en España de los recursos propios tradicionales, incluso obligaciones de ejercicios anteriores
2017;G;4;49;494/12001;;;Asistencia en el extranjero a beneficiarios de asilo en España
2017;G;4;49;494/12401;;;Acuerdo Sede SEGIB
2017;G;4;49;494/15004;;;Cuota Organización PuRE-net  (Public Real Estate Network)
2017;G;4;49;494/15014;;;Aportación española al Programa de Cooperación INTERACT III 2014-2020
2017;G;4;49;494/15102;;;Al Instituto Internacional de Ciencias Administrativas
2017;G;4;49;494/16002;;;Cooperación Internacional
2017;G;4;49;494/16003;;;Cooperación Internacional con otros países en materia policial
2017;G;4;49;494/16004;;;Cooperación policial con otros países
2017;G;4;49;494/18107;;;Cuotas a organismos internacionales y participación en programas educativos o culturales
2017;G;4;49;494/19101;;;Cuota PIACC y otras contribuciones a la OCDE. De ejercicios anteriores
2017;G;4;49;494/19104;;;Cuota PEROSH (Partnership for European Reseach on Occupational Health and Safety)
2017;G;4;49;494/20012;;;Para satisfacer las obligaciones de la pertenencia de España a la Conferencia Europea de Administraciones Postales y de Telecomunicaciones (CEPT), así como abonar las cuotas de participación y servicios derivados del Acuerdo con la CEPT sobre motorización de telecomunicaciones por satélite, a través de la Oficina Europea de Radiocomunicaciones (ERO)
2017;G;4;49;494/26401;;;Mantenimiento de la aplicación CTS para el procedimiento de reconocimiento mutuo de medicamentos autorizados
2017;G;4;49;494/27103;;;Cuotas a asociaciones internacionales relacionadas con la energía y el medio ambiente
2017;G;4;49;494/27104;;;Cuotas y gastos derivados de la representación española ante la OCDE
2017;G;4;49;494/34001;;;Aportación a la Unión Europea por prestación de servicios
2017;G;4;49;495/12003;;;Fundación Internacional Unión Europea-América Latina y Caribe
2017;G;4;49;495/15009;;;"Cuota participación en ""Asociación Iberoamericana de Tribunales de Justicia Fiscal o Administrativa"""
2017;G;4;49;495/15014;;;Aportación española al Programa de Cooperación Transnacional Espacio Mediterráneo Europeo (MED) 2014-2020
2017;G;4;49;495/16003;;;Cooperación Internacional con otros países: Ayudas directas
2017;G;4;49;495/18006;;;Para pago de cuotas a organismos internacionales y participación en programas educativos o culturales
2017;G;4;49;495/20012;;;Para satisfacer las obligaciones que se deriven para España del cumplimiento del Convenio Internacional de Telecomunicaciones (Nairobi 1982) y con la Secretaría General de la Unión Internacional de las Telecomunicaciones
2017;G;4;49;495/26401;;;Contribución para el mantenimiento de la aplicación CESP (Common Electronic Submission Portal) para el procedimiento de reconocimiento mutuo de medicamentos autorizados
2017;G;4;49;495/27009;;;Cuotas participación en organismos y contribuciones de comercio internacional
2017;G;4;49;495/34001;;;Aportación a la Unión Europea para el pago de indemnizaciones, multas y sanciones
2017;G;4;49;496/12003;;;Facilidad Financiera Internacional para la Inmunización
2017;G;4;49;496/12401;;;Para Ayuda Oficial al Desarrollo
2017;G;4;49;496/15004;;;Cuota a la Asociación XBRL España
2017;G;4;49;496/15014;;;Aportación española al Programa Operativo URBACT III 2014-2020
2017;G;4;49;496/16003;;;Cooperación Internacional con otros países: Formación
2017;G;4;49;496/16004;;;Cooperación Internacional: Formación
2017;G;4;49;496/20012;;;Cuota a la Asociación para el Cumplimiento de los Equipos Radio y Terminales de Telecomunicación (R&TTE CA)
2017;G;4;49;496/26401;;;Contribución al Foro de Políticas de la HTAI Policy Forum
2017;G;4;49;496/27007;;;Cuotas a Organizaciones Internacionales de Seguros
2017;G;4;49;496/27104;;;Para las actividades de cooperación con el CGIAR
2017;G;4;49;496/34001;;;Aportación a la Unión Europea para el Fondo de Refugiados para Turquía
2017;G;4;49;497/12001;;;Asistencia a ciudadanía que afronta condenas de pena de muerte
2017;G;4;49;497/12401;;;Contribuciones no previstas en Tratados y Acuerdos Internacionales
2017;G;4;49;497/15004;;;Cuota al Centro Europeo de Empresas Públicas (CEEP)
2017;G;4;49;497/20019;;;Organismo Internacional de la Energía Atómica
2017;G;4;49;498/12004;;;Participación en Organismos Internacionales. Contribuciones obligatorias, incluídas obligaciones de ejercicios anteriores
2017;G;4;49;498/15005;;;Aportación a la OCDE para la financiación de la Secretaría del Acuerdo Multilateral entre autoridades competentes
2017;G;4;49;499/12004;;;Participación en Organismos Internacionales. Contribuciones voluntarias
2017;G;4;49;499/15005;;;Aportación a la OCDE para la financiación del Órgano coordinador del Convenio sobre asistencia administrativa mutua en materia fiscal
2017;G;4;49;499/20012;;;A la Iniciativa Ambient Asistent Living Association (AAL)
2017;G;4;49;499/27012;;;Transferencias, ayudas nominativas y otros
2017;G;4;49;499/27014;;;Transferencias, ayudas nominativas y otros
2017;G;5;;;;;Fondo de contingencia y otros imprevistos
2017;G;5;50;;;;Dotación al Fondo de Contingencia de ejecución presupuestaria
2017;G;5;50;500;;;Fondo de Contingencia de Ejecución Presupuestaria, Artículo 50 de la Ley 47/2003, de 26 de noviembre, General Presupuestaria
2017;G;5;51;;;;Otros Imprevistos
2017;G;5;51;510;;;Imprevistos
2017;G;6;;;;;Inversiones reales
2017;G;6;60;;;;Inversión nueva en infraestructuras y bienes destinados al uso general
2017;G;6;60;600;;;Inversiones en terrenos
2017;G;6;60;601;;;Otras
2017;G;6;60;602;;;Actuaciones relacionadas con la sequía
2017;G;6;60;603;;;Plan PIMA ADAPTA. Actuaciones financiadas con ingresos procedentes de subastas de derechos de emisión
2017;G;6;60;609/17038;;;Expropiaciones, modificados, adicionales y otras incidencias de inversiones de ejercicios anteriores
2017;G;6;60;609/23005;;;Expropiaciones, modificados, adicionales y otras incidencias de inversiones de ejercicios anteriores.
2017;G;6;60;609/23018;;;Expropiaciones, modificados, adicionales y otras incidencias de inversiones de ejercicios anteriores.
2017;G;6;61;;;;Inversión de reposición en infraestructuras y bienes destinados al uso general
2017;G;6;61;610;;;Inversiones en terrenos
2017;G;6;61;611;;;Otras
2017;G;6;61;612/23018;;;Otras inversiones del medio natural y política forestal
2017;G;6;61;612/23107;;;Actuaciones relacionadas con la sequía
2017;G;6;61;614;;;PIMA ADAPTA Costas. Actuaciones financiadas con ingresos procedentes de subastas de derechos de emisión
2017;G;6;61;615;;;Inversiones en actuaciones medioambientales. Actuaciones financiadas con ingresos  procedentes de subastas de derechos de emisión.
2017;G;6;61;616;;;Plan PIMA ADAPTA. Actuaciones financiadas con ingresos procedentes de subastas de derechos de emisión
2017;G;6;61;619/17038;;;Expropiaciones, modificados, adicionales y otras incidencias de inversiones de ejercicios anteriores
2017;G;6;61;619/23005;;;Incidencias de inversiones de ejercicios anteriores.
2017;G;6;61;619/23018;;;Incidencias de inversiones de ejercicios anteriores
2017;G;6;62;;;;Inversión nueva asociada al funcionamiento operativo de los servicios
2017;G;6;62;620;;;Inversión nueva asociada al funcionamiento operativo de los servicios
2017;G;6;62;621;;;Inversiones producto del 1% cultural, artículo 68 Ley 16/85, de 25 de junio,del Patrimonio Histórico Español para adquisición de bienes culturales
2017;G;6;62;622;;;Pago de indemnizaciones a que se refiere la Ley 36/1994, de 23 de diciembre, de incorporación de la Directiva 93/7 de la CEE relativa a la restitución de bienes culturales que hayan salido del territorio de un estado miembro y pago de los costes derivados de la devolución de bienes culturales previsto en el instrumento de adhesión de España al Convenio UNIDROIT sobre bienes culturales robados o exportados ilegalmente de 24 de junio de 1995
2017;G;6;62;623;;;Para el impulso de la modernización del Servicio Público de Justicia
2017;G;6;62;628;;;Patrimonio Sindical Acumulado
2017;G;6;63;;;;Inversión de reposición asociada al funcionamiento operativo de los servicios
2017;G;6;63;630;;;Inversión de reposición asociada al funcionamiento operativo de los servicios
2017;G;6;63;631/18011;;;Inversiones producto del 1% cultural, artículo 68 Ley 16/85, de 25 de Junio, del Patrimonio Histórico Español, para obras de conservación y restauración de bienes culturales
2017;G;6;63;631/25301;;;Inversión de cualquier naturaleza del CNI
2017;G;6;63;638;;;Patrimonio Sindical Acumulado
2017;G;6;64;;;;Gastos de inversiones de carácter inmaterial
2017;G;6;64;640;;;Gastos en inversiones de carácter inmaterial
2017;G;6;64;641;;;Inversiones inmateriales relacionadas con las inversiones en infraestructuras rurales
2017;G;6;64;649;;;Incidencias de inversiones de ejercicios anteriores
2017;G;6;65;;;;Inversiones militares en infraestructura y otros bienes
2017;G;6;65;650;;;Inversiones militares en infraestructura y otros bienes
2017;G;6;65;655;;;Programas especiales de modernización del Ejercito de Tierra
2017;G;6;65;656;;;Programas especiales de modernización de la Armada
2017;G;6;65;657;;;Programas especiales de modernización del Ejercito del Aire
2017;G;6;65;658;;;Programas especiales de modernización de interés conjunto
2017;G;6;66;;;;Inversiones militares asociadas al funcionamiento operativo de los servicios
2017;G;6;66;660;;;Inversiones militares asociadas al funcionamiento operativo de los servicios
2017;G;6;66;668;;;Gastos originados por participación de las Fuerzas Armadas en operaciones de mantenimiento de la paz
2017;G;6;67;;;;Gastos militares de inversiones de carácter inmaterial
2017;G;6;67;670;;;Gastos militares en inversiones de carácter inmaterial
2017;G;7;;;;;Transferencias de capital
2017;G;7;70;;;;A la Administración del Estado
2017;G;7;70;700/20302;;;Proyectos de colaboración con la Unión Europea
2017;G;7;70;700/23114;;;Estado. Ayudas Desarrollo Rural.FEGA Organismo pagador
2017;G;7;71;;;;A Organismos Autónomos
2017;G;7;71;710/14003;;;A organismos autónomos del Departamento
2017;G;7;71;710/15005;;;Al Instituto de Estudios Fiscales
2017;G;7;71;710/17020;;;Centro de Estudios y Experimentación de Obras Públicas (CEDEX)
2017;G;7;71;710/18001;;;Al Consejo Superior de Deportes
2017;G;7;71;710/18006;;;A la Universidad Internacional Menéndez Pelayo
2017;G;7;71;710/23004;;;Parques Nacionales
2017;G;7;71;710/23005;;;Confederaciones Hidrográficas
2017;G;7;71;710/25002;;;Al Centro de Estudios Políticos y Constitucionales
2017;G;7;71;710/26015;;;Al Instituto de la Juventud
2017;G;7;71;710/27011;;;Al Instituto Geológico y Minero de España (IGME)
2017;G;7;71;710/31004;;;Al Parque Móvil del Estado
2017;G;7;71;711/13002;;;Al Centro de Estudios Jurídicos de la Administración de Justicia
2017;G;7;71;711/18001;;;Al Consejo Superior de Deportes para el cumplimiento de las obligaciones derivadas de la Ley 13/2011, de 27 de mayo, de regulación del juego en relación con el Real Decreto 419/1991, de 27 de marzo, por el que se regula la distribución de la recaudación y premios de las apuestas deportivas del Estado
2017;G;7;71;711/25002;;;Al Centro de Investigaciones Sociológicas.
2017;G;7;71;711/26015;;;Al Consejo de la Juventud de España
2017;G;7;71;711/27011;;;Al Centro de Investigaciones Energéticas, Medioambientales y Tecnológicas (CIEMAT)
2017;G;7;71;712/17018;;;Centro Nacional de Información Geográfica (CNIG)
2017;G;7;71;712/18009;;;A la Biblioteca Nacional
2017;G;7;71;712/19003;;;Al Instituto Nacional de Seguridad e Higiene en el Trabajo
2017;G;7;71;712/20018;;;Al Instituto para la Reestructuración de la Minería del Carbón y Desarrollo Alternativo de las Comarcas Mineras
2017;G;7;71;712/23011;;;Agencia de Información y Control Alimentario (AICA)
2017;G;7;71;712/26004;;;A la Agencia Española de Consumo, Seguridad Alimentaria y Nutrición
2017;G;7;71;712/27011;;;Al Instituto Español de Oceanografía (IEO)
2017;G;7;71;713/19003;;;Para financiar el presupuesto del Servicio Público de Empleo Estatal
2017;G;7;71;713/20004;;;Al Instituto de Turismo de España
2017;G;7;71;713/23004;;;Parques Nacionales. Plan PIMA ADAPTA. Actuaciones financiadas con ingresos procedentes de subasta de derechos de emisión
2017;G;7;71;713/23011;;;Fondo Español de Garantía Agraria (FEGA)
2017;G;7;71;713/27011;;;Al Instituto Nacional de Investigación y Tecnología Agraria y Alimentaria (INIA)
2017;G;7;71;714/18009;;;Al Instituto de la Cinematografía y de las Artes Audiovisuales
2017;G;7;71;714/23001;;;Entidad Estatal de Seguros Agrarios (ENESA)
2017;G;7;71;714/23011;;;Fondo Español de Garantía Agraria (FEGA). Programa Nacional de Desarrollo Rural 2015-2020
2017;G;7;71;714/26009;;;A la Organización Nacional de Trasplantes
2017;G;7;71;714/27003;;;Al Instituto Nacional de Estadística (INE)
2017;G;7;71;714/27011;;;Al Instituto de Salud Carlos III (ISCIII)
2017;G;7;71;715;;;Instituto Geológico y Minero de España
2017;G;7;71;716/18009;;;Al Instituto Nacional de las Artes Escénicas y de la Música
2017;G;7;71;716/26015;;;Al Instituto de la Mujer y para la Igualdad de Oportunidades
2017;G;7;71;716/27015;;;Al Centro Español de Metrología
2017;G;7;71;717/18006;;;Al Servicio Español para la Internacionalización de la Educación
2017;G;7;71;717/18009;;;A la Gerencia de Infraestructuras y Equipamientos
2017;G;7;71;717/25002;;;Al Consejo de Administración del Patrimonio Nacional
2017;G;7;71;718/15026;;;Al Instituto Nacional de Administración Pública (INAP)
2017;G;7;71;718/18006;;;Al Servicio Español para la Internacionalización de la Educación, para potenciar la proyección internacional del sistema universitario español y su oferta, así como la movilidad interuniversitaria
2017;G;7;71;719/18006;;;A la Agencia Nacional de Evaluación de la Calidad y Acreditación
2017;G;7;71;719/26015;;;Al Real Patronato sobre Discapacidad
2017;G;7;72;;;;A la Seguridad Social
2017;G;7;72;720/26015;;;Al IMSERSO, para el cumplimiento de sus fines
2017;G;7;72;720/60001;;;A la Seguridad Social
2017;G;7;72;720/60003;;;A la Seguridad Social
2017;G;7;72;721;;;Aportación del Estado a la Tesorería General de la Seguridad Social para financiar las operaciones de capital del Instituto Nacional de Gestión Sanitaria
2017;G;7;72;726;;;Aportación del Estado a la Seguridad Social para financiar los servicios sociales del ISM
2017;G;7;72;727;;;Aportación del Estado a la Tesorería General de la Seguridad Social para financiar la asistencia sanitaria del Instituto Social de la Marina
2017;G;7;72;729;;;Al IMSERSO para otros gastos en dependencia
2017;G;7;73;;;;A otras entidades del Sector Público Administrativo Estatal con presupuesto limitativo
2017;G;7;73;730/12003;;;A la Agencia Española de Cooperación Internacional para el Desarrollo, para atender los gastos derivados de proyectos de Ayuda Oficial al Desarrollo, incluidos los propuestos o a ejecutar por Organizaciones No Gubernamnetales, con destino a países en vías desarrollo.
2017;G;7;73;730/15026;;;A la Agencia Estatal de Evaluación de las Políticas Públicas y la Calidad de los Servicios (AEVAL)
2017;G;7;73;730/17009;;;Consejo Superior de Investigaciones Científicas
2017;G;7;73;730/18001;;;A la Agencia Española de Protección de la Salud en el Deporte
2017;G;7;73;730/18011;;;"Al Centro Nacional de Investigaciones Metalúrgicas del CSIC, para el proyecto ""Observatorio de Investigación en Conservación del Patrimonio"""
2017;G;7;73;730/23004;;;Agencia Estatal de Meteorología
2017;G;7;73;730/27011;;;Al Consejo Superior de Investigaciones Científicas (CSIC)
2017;G;7;73;730/27103;;;A la Agencia Estatal CSIC para la realización de trabajos relativos a los efectos de la contaminación atmosférica sobre la vegetación
2017;G;7;73;731/17020;;;Agencia Estatal de Seguridad Ferroviaria
2017;G;7;73;731/27011;;;A la Agencia Estatal de Investigación
2017;G;7;73;735/15005;;;A la Agencia Estatal de Administración Tributaria (A.E.A.T.)
2017;G;7;73;735/19001;;;Al Consejo Económico y Social
2017;G;7;73;736;;;Al Museo Nacional Centro de Arte Reina Sofía, para la integración de la Arquitectura en el discurso museográfico
2017;G;7;73;737/12003;;;Al Instituto Cervantes
2017;G;7;73;737/15026;;;Al Consejo de Transparencia y Buen Gobierno
2017;G;7;73;737/18009;;;Al Museo Nacional del Prado
2017;G;7;73;737/20018;;;A la CNMC para financiar costes del sector eléctrico de acuerdo con el apartado b) de la disposición adicional segunda de la Ley 15/2012, de 27 de diciembre, de medidas fiscales para la sostenibilidad energética
2017;G;7;73;737/25002;;;Al Centro Nacional de Inteligencia
2017;G;7;73;737/27003;;;A la Comisión Nacional de los Mercados y la Competencia (CNMC)
2017;G;7;73;738/18009;;;Al Museo Nacional Centro de Arte Reina Sofía
2017;G;7;73;738/20018;;;A la CNMC para financiar costes del sector eléctrico de acuerdo con el apartado a) de la disposición adicional segunda de la Ley 15/2012, de 27 de diciembre, de medidas fiscales para la sostenibilidad energética
2017;G;7;73;739;;;A la CNMC para atender el extracoste de generación al que se refiere la disposición adicional decimoquinta de la Ley 24/2013, de 26 de diciembre, del Sector Eléctrico
2017;G;7;74;;;;A Sociedades, Entidades Públicas Empresariales, Fundaciones y resto de entidades del Sector Público Estatal
2017;G;7;74;740/14001;;;Centros Universitarios de la Defensa
