EJERCICIO;GASTO/INGRESO;CAPITULO;ARTICULO;CONCEPTO;SUBCONCEPTO;DESCRIPCION CORTA;DESCRIPCION LARGA
2017;G;4;47;470/17020;;;Para compensar a  Autopista  Vasco-Aragonesa, Concesionaria Española, S.A.
2017;G;4;47;470/17034;;;Contrato de Servicio de Transporte aéreo para satisfacer obligaciones de servicio público en Canarias
2017;G;4;47;470/18013;;;Ayudas a empresas editoras radicadas en España para fomento de la traducción de libros a lenguas extranjeras
2017;G;4;47;470/18102;;;Ayudas a Universidades Privadas para participación en ferias y otras acciones de internacionalización
2017;G;4;47;470/18103;;;Fondo de Protección a la Cinematografía
2017;G;4;47;470/19003;;;Subvenciones a universidades privadas para acciones de formación, difusión y fomento del trabajo autónomo, de la economía social y de la responsabilidad social de las empresas, de ámbito estatal
2017;G;4;47;470/23012;;;Asociación Española de Sociedades Españolas organizadoras de carreras de caballos y actividades hípicas, para subvencionar carreras nacionales de caballos españoles, premios y otras actividades relacionadas con las carreras
2017;G;4;47;470/23018;;;Actuaciones para jóvenes del medio rural
2017;G;4;47;470/23101;;;Indemnización a particulares por pérdida de renta en Parques Nacionales.
2017;G;4;47;470/23114;;;Producción agraria con aportación financiera del FEAGA.
2017;G;4;47;470/26107;;;Programas de incentivación de planes de igualdad para pyme
2017;G;4;47;470/27010;;;Premios al pequeño comerciante para el desarrollo comercial y la modernización empresarial
2017;G;4;47;471/15301;;;Subvenciones a entidades privadas para la realización de prácticas en la Autoridad Independiente de Responsabilidad Fiscal
2017;G;4;47;471/16001;;;Por actividades realizadas a requerimiento de la autoridad competente en situaciones de emergencia
2017;G;4;47;471/17001;;;Abono de indemnizaciones por Sentencias de Tribunales
2017;G;4;47;471/17020;;;Para compensar a Autopistas, Concesionaria Española, S.A., por  bonificaciones en el peaje de los recorridos  entre Alfajarín y Fraga, según Convenio
2017;G;4;47;471/17034;;;Contrato de Servicio de Transporte aéreo para satisfacer obligaciones de servicio público en Menorca
2017;G;4;47;471/17039;;;Garantía de intereses para ferrocarriles secundarios
2017;G;4;47;471/18011;;;Ayudas para la promoción del arte contemporáneo español
2017;G;4;47;471/18013;;;A la Sociedad de Garantía Recíproca Audiovisual Finanzas SGR para la subvención del coste de los avales de los préstamos a empresas e industrias culturales
2017;G;4;47;471/18107;;;A orquestas, grupos de cámara, compañías de teatro, circenses y de danza para giras por el extranjero
2017;G;4;47;471/19007;;;Ayudas para proyectos, iniciativas y acciones dirigidas a españoles en el exterior y retornados
2017;G;4;47;471/20001;;;Para subvencionar a plantas potabilizadoras de agua en Canarias
2017;G;4;47;471/20019;;;Para compensación por costes adicionales derivados de la financiación del apoyo a la energía eléctrica procedente de fuentes renovables
2017;G;4;47;471/20101;;;Ayudas a los costes de explotación para empresas mineras productoras de carbón
2017;G;4;47;471/20102;;;Programa de fomento de las solicitudes de patentes y modelos de utilidad en el exterior a empresa privada y persona física titular del derecho
2017;G;4;47;471/23001;;;Cumplimiento de sentencias de los Tribunales de Justicia.
2017;G;4;47;471/23113;;;Plan Anual de Seguros Agrarios y liquidación de Planes anteriores.
2017;G;4;47;471/60001;;;Entregas de botiquines
2017;G;4;47;472/16001;;;Para atenciones de todo orden motivadas por siniestros, catástrofes u otros de reconocida urgencia
2017;G;4;47;472/17020;;;Subvención al funcionamiento de las Autopistas del Mar entre España y Francia
2017;G;4;47;472/18103;;;Ayudas a la organización de festivales nacionales e internacionales
2017;G;4;47;472/19101;;;Gestión de servicios y programas  de políticas activas de empleo en territorio no transferido
2017;G;4;47;472/20001;;;Para subvencionar a plantas potabilizadoras de agua en Canarias y a comunidades de pozos para el riego agrícola
2017;G;4;47;472/20102;;;Programa de fomento de las solicitudes de patentes y modelos de utilidad en España para PYMES y persona física titular del derecho
2017;G;4;47;472/23014;;;"Convenio de colaboración con la Fundación Dieta Mediterránea, para promocionar las características de la ""dieta mediterránea"" y los productos que la componen"
2017;G;4;47;472/23114;;;Ayudas a la explotación de vacuno de leche
2017;G;4;47;472/60001;;;Ayudas para balsas de salvamento
2017;G;4;47;473/17020;;;Para compensar la pérdida de ingresos por la rebaja de las tarifas de peaje
2017;G;4;47;473/18107;;;Giras y producciones de personas y conjuntos musicales y coreográficos
2017;G;4;47;473/23114;;;Subvenciones nacionales para la cofinanciación de ayudas con Fondos Europeos Agrícolas
2017;G;4;47;473/60001;;;Para incentivos a la reducción de la siniestralidad laboral y a actuaciones de prevención de riesgos profesionales
2017;G;4;47;473/60003;;;Para incentivos a la reducción de la siniestralidad laboral y a actuaciones de prevención de riesgos profesionales
2017;G;4;47;474/17020;;;Para compensar a Autopista Concesionaria Astur Leonesa S.A.
2017;G;4;47;474/19101;;;Formación, orientación profesional y promoción de la actividad emprendedora de los trabajadores autónomos beneficiarios de la protección por cese de actividad. Territorio no transferido: Ceuta y Melilla
2017;G;4;47;474/20101;;;Costes sociales y técnicos y obligaciones por reordenación
2017;G;4;47;474/23114;;;Subvenciones nacionales para la cofinanciación de ayudas a la apicultura con Fondos Europeos Agrícolas
2017;G;4;47;475/17020;;;Para compensar a las sociedades concesionarias de autopistas de peaje por la modificación temporal de las tarifas de acuerdo con lo dispuesto en el Real Decreto Ley 11/2001, de 22 de junio
2017;G;4;47;475/18107;;;A programas de difusión nacional de la dramaturgia actual y de preservación y difusión del teatro clásico y desarrollo de la actividad circense a través de planes de comunicación y difusión en España
2017;G;4;47;475/26101;;;A empresas privadas Progama Erasmus+/Juventud
2017;G;4;47;476/17020;;;Para compensar a Autopista Madrid-Toledo en cumplimiento de sentencia del Tribunal Supremo de 16 de Mayo de 2011
2017;G;4;47;476/26101;;;Ayudas a Emprendimiento Joven.
2017;G;4;47;477/17020;;;Para compensar a Autopistas del Atlántico, Concesionaria Española, S.A. por la supresión del peaje de los movimientos O Morrazo - Vigo y A Coruña - A Barcala, e inversos
2017;G;4;47;477/18013;;;Ayudas para empresas editoras de revistas culturales
2017;G;4;47;478/17020;;;Subvención al transporte marítimo y aéreo de mercancías entre la Península y las Islas o entre éstas y la Península, así como entre las Islas y el de exportación de las mismas a países extranjeros de acuerdo con la legislación vigente
2017;G;4;47;478/18106;;;A Universidades y entidades privadas para programas de apoyo científico al deporte y actividades afines
2017;G;4;47;479;;;Para compensar a Autopistas, Concesionaria Española, S.A. por las reducciones de peaje en la autopista AP-7 a su paso por Girona, según Convenio
2017;G;4;48;;;;A familias e instituciones sin fines de lucro
2017;G;4;48;480/01001;;;A S.M. el Rey. Para el sostenimiento de su Familia y Casa (Art. 65 de la Constitución)
2017;G;4;48;480/02001;;;A Familias e Instituciones sin fines de lucro
2017;G;4;48;480/02002;;;A Familias e Instituciones sin fines de lucro
2017;G;4;48;480/02003;;;A familias e instituciones sin fines de lucro
2017;G;4;48;480/02004;;;A Familias e Instituciones sin fines de lucro
2017;G;4;48;480/02005;;;A Familias e Instituciones sin fines de lucro
2017;G;4;48;480/04001;;;Pensión exPresidentes del Tribunal Constitucional (Ley 21/86)
2017;G;4;48;480/07001;;;Otras pensiones y prestaciones
2017;G;4;48;480/08001;;;A Asociaciones y Fundaciones sin ánimo de lucro relacionadas con la Administración de Justicia
2017;G;4;48;480/13102;;;Subsidios e Indemnizaciones
2017;G;4;48;480/14101;;;A familias e instituciones sin fines de lucro
2017;G;4;48;480/14113;;;Subsidios e indemnizaciones
2017;G;4;48;480/15001;;;A familias e instituciones sin fines de lucro
2017;G;4;48;480/15101;;;Becas
2017;G;4;48;480/15102;;;Becas, ayudas y premios de estudios e investigación
2017;G;4;48;480/15106;;;Subsidios e Indemnizaciones
2017;G;4;48;480/15302;;;A familias e instituciones sin fines de lucro
2017;G;4;48;480/15304;;;Becas, ayudas y premios de estudios e investigación
2017;G;4;48;480/16001;;;Subvenciones según el artículo 65 de la Ley 29/2011, de 22 de septiembre, de Reconocimiento y Protección Integral  a las Víctimas del Terrorismo, a asociaciones, fundaciones y entidades sin ánimo de lucro cuyo objetivo sea la representación y defensa de los intereses de las víctimas del terrorismo
2017;G;4;48;480/17001;;;Cuotas y contribuciones a Organismos e Instituciones Nacionales
2017;G;4;48;480/17018;;;Cuotas y contribuciones a Organismos e Instituciones Nacionales
2017;G;4;48;480/17039;;;Comité Nacional del transporte por carretera (Actividades relacionadas con la Ley de Ordenacion de los Transportes Terrestres)
2017;G;4;48;480/18004;;;Para financiar actividades de enseñanza de adultos y de carácter compensatorio
2017;G;4;48;480/18005;;;Para financiar actividades de enseñanza de adultos y de carácter compensatorio
2017;G;4;48;480/18008;;;Actividades de formación, intercambio y aprendizaje
2017;G;4;48;480/18009;;;Pensiones complementarias del personal de MECSE
2017;G;4;48;480/18011;;;Ayudas a entidades privadas sin fines de lucro y reales academias para la preservación del Patrimonio Digital
2017;G;4;48;480/18013;;;A fundaciones para actividades culturales y gastos de funcionamiento
2017;G;4;48;480/18101;;;Aportación a la Fundación UIMP/Campo de Gibraltar
2017;G;4;48;480/18104;;;Premio de bibliografía española
2017;G;4;48;480/18106;;;Comité Paralímpico Español
2017;G;4;48;480/18107;;;A programas de actividades musicales de entidades sin fines de lucro
2017;G;4;48;480/18301;;;Becas y ayudas para formación y perfeccionamiento en materias museísticas
2017;G;4;48;480/18302;;;Becas y ayudas para formación y perfeccionamiento en materias museísticas
2017;G;4;48;480/19001;;;A los participantes en órganos consultivos y consejos.
2017;G;4;48;480/19101;;;Prestaciones por desempleo
2017;G;4;48;480/20001;;;Para concesión de becas, asistencia a congresos, cursos, seminarios y otras subvenciones
2017;G;4;48;480/23001;;;Órganos Colegiados de la Administración de carácter agrario.
2017;G;4;48;480/23012;;;Programa técnico formativo en producciones y mercados agrarios
2017;G;4;48;480/23014;;;Becas de formación
2017;G;4;48;480/23018;;;Becas de formación en materia de desarrollo rural
2017;G;4;48;480/23019;;;Becas de formación en general
2017;G;4;48;480/23104;;;Instituciones sin fines de lucro
2017;G;4;48;480/23109;;;Ayudas y becas aplicación Directiva Marco del Agua
2017;G;4;48;480/23114;;;Pensiones a familias de carácter civil
2017;G;4;48;480/23401;;;Becas de estudios
2017;G;4;48;480/25001;;;Dotación ex-Presidentes del Gobierno (R.D. 405/92)
2017;G;4;48;480/25004;;;A la Federación Española de Municipios y Provincias
2017;G;4;48;480/25401;;;Becas de postgrado
2017;G;4;48;480/26016;;;A la Fundación Víctimas del Terrorismo
2017;G;4;48;480/26022;;;Ayudas sociales para mujeres (art 27 de la L.O.1/2004, de 28 de diciembre)
2017;G;4;48;480/26105;;;A familias e instituciones sin fines de lucro. Becas
2017;G;4;48;480/26106;;;A la Fundación Eguía-Careaga para el Centro Español de Documentación sobre Discapacidad
2017;G;4;48;480/27008;;;Becas Fulbright de comercio
2017;G;4;48;480/27011;;;Transferencias, ayudas nominativas y otros
2017;G;4;48;480/27012;;;A la Secretaría de la Asociación Red INNPULSO para gastos de funcionamiento
2017;G;4;48;480/27101;;;A la Sociedad Española de Estadística e Investigación Operativa (AECA)
2017;G;4;48;480/27102;;;A la Asociación Española de Administración y Contabilidad de Empresas
2017;G;4;48;480/27105;;;Pago de cuotas a organismos nacionales
2017;G;4;48;480/27106;;;Cuotas y ayudas a organismos y entidades en las que colabore o participe el IGME
2017;G;4;48;480/27402;;;Para actividades complementarias
2017;G;4;48;480/60002;;;A Familias e instituciones sin fines de lucro
2017;G;4;48;480/60003;;;A Familias e instituciones sin fines de lucro
2017;G;4;48;481/04001;;;Remuneraciones de transición Magistrados (art. 25.1 Ley Orgánica del Tribunal Constitucional, 2/1979, de 3 de octubre)
2017;G;4;48;481/07001;;;Pensiones e indemnizaciones de guerra
2017;G;4;48;481/12001;;;A familias e instituciones sin fines de lucro
2017;G;4;48;481/12002;;;A familias e instituciones sin fines de lucro
2017;G;4;48;481/12004;;;A familias e instituciones sin fines de lucro
2017;G;4;48;481/12301;;;Becas Instituto Cervantes
2017;G;4;48;481/12401;;;Ayudas y convenios básicos de cooperación
2017;G;4;48;481/13102;;;Protección a la familia
2017;G;4;48;481/14001;;;Fondo de reconocimiento de servicios prestados en el territorio de Ifni-Sahara
2017;G;4;48;481/14107;;;Indemnización por desalojo de vivienda
2017;G;4;48;481/14113;;;Protección a la familia
2017;G;4;48;481/15001;;;A la Hermandad de Jubilados del Ministerio de Economía y Hacienda
2017;G;4;48;481/15102;;;Formación para el Empleo en las Administraciones Públicas
2017;G;4;48;481/15106;;;Protección a la familia
2017;G;4;48;481/16002;;;Para todo tipo de atenciones derivadas de la inmigración
2017;G;4;48;481/16003;;;A la Fundación de Huérfanos de la Dirección General de la Policía para apoyar la formación educativa de los huérfanos de funcionarios del CNP
2017;G;4;48;481/16005;;;Transferencia a la Comisión Episcopal para atención del culto en centros penitenciarios
2017;G;4;48;481/17001;;;Subvenciones a la realización de actividades relacionadas con los programas del Departamento, referidas a las obras públicas, los transportes y las comunicaciones postales y telegráficas, a distribuir por Orden Ministerial
2017;G;4;48;481/17032;;;Para satisfacer la bonificación a residentes no peninsulares por traslado a la Península y regreso por vía marítima, así como por los traslados interinsulares
2017;G;4;48;481/17039;;;I T S. España (Sistemas Inteligentes de Transporte)
2017;G;4;48;481/17101;;;Becas del CEDEX
2017;G;4;48;481/17401;;;Premios de Jubilación
2017;G;4;48;481/18001;;;Ayudas al Instituto de España, reales academias y otras instituciones adscritas al programa para desarrollo de actividades y gastos de funcionamiento
2017;G;4;48;481/18004;;;Para hacer efectiva la gratuidad de la enseñanza en centros educativos
2017;G;4;48;481/18006;;;A la Fundación César Carlos para sus actividades
2017;G;4;48;481/18011;;;Premios nacionales
2017;G;4;48;481/18013;;;Ayudas para la acción y la promoción cultural
2017;G;4;48;481/18101;;;Al Centro Iberoamericano de Gobernabilidad, Administración y Políticas Públicas Locales
2017;G;4;48;481/18102;;;Para actuaciones relacionadas con programas educativos europeos
2017;G;4;48;481/18103;;;Ayudas a la organización de festivales y mercados cinematográficos nacionales e internacionales
2017;G;4;48;481/18104;;;Becas para la formación y  especialización
2017;G;4;48;481/18107;;;Programa de actividades musicales de ámbito nacional e internacional
2017;G;4;48;481/19002;;;Prestaciones asistenciales
2017;G;4;48;481/19101;;;A familias e instituciones sin fines de lucro
2017;G;4;48;481/19102;;;Pago prestaciones acordadas a trabajadores segun la legislación vigente, incluidas obligaciones de ejercicios anteriores
2017;G;4;48;481/19104;;;Para la concesión de becas de formación e investigación
2017;G;4;48;481/20001;;;Para premios a la innovación
2017;G;4;48;481/20102;;;A los funcionarios de las oficinas iberoamericanas de la Propiedad Industrial designados por las mismas y de conformidad con el acuerdo suscrito por la Oficina Española de Patentes y Marcas (OEPM) con cada una de ellas (Programa CIBIT)
2017;G;4;48;481/20302;;;A Familias e instituciones sin fines de lucro
2017;G;4;48;481/23018;;;Fomento de asociacionismo
2017;G;4;48;481/23101;;;Pensiones a familias de carácter civil
2017;G;4;48;481/23103;;;Comité de Grandes Presas
2017;G;4;48;481/23107;;;Comité Español de Grandes Presas.
2017;G;4;48;481/23109;;;Pensiones a funcionarios de carácter civil
2017;G;4;48;481/23113;;;Organizaciones Agrarias. Modulación
2017;G;4;48;481/23114;;;Becas de formación
2017;G;4;48;481/25004;;;"Pensión vitalicia como consecuencia de la Sentencia de 20 de abril de 1994 de la Sección Sexta de la Audiencia Provincial de Madrid (Asunto ""Alcalá 20"")"
2017;G;4;48;481/25101;;;A familias e Instituciones sin fines de lucro.
2017;G;4;48;481/25102;;;Becas a postgraduados
2017;G;4;48;481/25103;;;Subvención a los Reales Patronatos y Fundaciones (Párrafo 2 del Art. 2 de la Ley 23/82 del Patrimonio Nacional)
2017;G;4;48;481/26004;;;Para subvencionar a instituciones y entidades de cualquier titularidad sin ánimo de lucro, para el fomento de la donación y el trasplante de órganos y tejidos
2017;G;4;48;481/26017;;;A la Confederación Estatal de Personas Sordas para la atención a personas sordas en el ejercicio de sus derechos básicos
2017;G;4;48;481/26018;;;A ONGs sin ánimo de lucro, de ámbito estatal, para el desarrollo de programas supracomunitarios en el marco de prioridades del Plan Nacional sobre Drogas
2017;G;4;48;481/26022;;;Becas de formación Observatorio Estatal de violencia sobre la mujer
2017;G;4;48;481/26101;;;A Asociaciones juveniles y entidades de ámbito nacional prestadoras de servicios a la juventud
2017;G;4;48;481/26105;;;Prestaciones sociales
2017;G;4;48;481/26106;;;A la Fundación CENTAC para el Centro Nacional de Tecnologías de la Accesibilidad
2017;G;4;48;481/26107;;;Transferencias a entidades y personas físicas para realizar actividades que fomenten la no discriminación de la mujer y su participación en la sociedad
2017;G;4;48;481/26401;;;Para atender becas de formación de postgrado en evaluación y control de medicamentos, mediante convocatoria y adjudicación por la Agencia Española de Medicamentos y Productos Sanitarios
2017;G;4;48;481/27010;;;Premios a asociaciones de comerciantes sin fines de lucro para creación y desarrollo de centros comerciales abiertos
2017;G;4;48;481/27012;;;Premios Nacionales de Investigación
2017;G;4;48;481/27101;;;Al Centro de Educación a Distancia para el Desarrollo Económico y Tecnológico (CEDDET)
2017;G;4;48;481/27109;;;Becas a estudiantes en prácticas
2017;G;4;48;481/27302;;;Becas de la CNMC
2017;G;4;48;481/60001;;;Pensiones
2017;G;4;48;481/60002;;;Pensiones
2017;G;4;48;482/04001;;;A la Asociación de Letrados del Tribunal Constitucional
2017;G;4;48;482/05001;;;Indemnizaciones
2017;G;4;48;482/07001;;;Prestaciones sociales
2017;G;4;48;482/12004;;;Para defensa y protección de los Derechos Humanos
2017;G;4;48;482/12401;;;Instituciones adheridas en España
2017;G;4;48;482/13102;;;Servicios Sociales
2017;G;4;48;482/14017;;;Indemnización vitalicia como consecuencia de la Sentencia de 10 de Mayo de 2000, de la Sección Cuarta de ContenciosoAdministrativo de la Audiencia Nacional (Recurso número 0497/1999)
2017;G;4;48;482/14107;;;Compensación económica por carencia de vivienda
2017;G;4;48;482/14113;;;Servicios Sociales
2017;G;4;48;482/15026;;;Apoyo instrumental a la negociación colectiva Ley 7/2007, del Estatuto Básico del Empleado Público
2017;G;4;48;482/15106;;;Servicios Sociales
2017;G;4;48;482/16001;;;Para atenciones de todo orden motivadas por siniestros, catástrofes u otros de reconocida urgencia
2017;G;4;48;482/16002;;;A la Cruz Roja Española para programas asistenciales en CIES
2017;G;4;48;482/16004;;;Al Colegio de Huérfanos de la Guardia Civil para apoyar la formación educativa y protección social de los huérfanos de los socios fallecidos
2017;G;4;48;482/16005;;;Para atenciones de los internos, liberados y familiares
2017;G;4;48;482/17001;;;Asociación Recreativo Cultural del Ministerio de Fomento
2017;G;4;48;482/17018;;;Subvención a la Real Sociedad Geográfica
2017;G;4;48;482/17101;;;Cuotas a asociaciones técnicas nacionales
2017;G;4;48;482/18003;;;A la Fundación Francisco Giner de los Ríos (Institución Libre de Enseñanza) para apoyo de sus actividades
2017;G;4;48;482/18004;;;Becas de formación de especialistas en investigación, innovación, documentación e informática en materia educativa
2017;G;4;48;482/18008;;;Becas y ayudas al estudio de carácter general
2017;G;4;48;482/18102;;;Para actividades relacionadas con la proyección internacional de la educación
2017;G;4;48;482/18103;;;Ayudas a la cinematografía a través de familias e instituciones sin fines de lucro
2017;G;4;48;482/18107;;;Becas y ayudas a personas o asociaciones para actividades musicales, líricas, teatrales, circenses y coreográficas en el exterior
2017;G;4;48;482/19003;;;Subvenciones y aportaciones para fomento del empleo, protección del desempleo y ayudas a la jubilación
2017;G;4;48;482/19101;;;Reserva de gestión directa del Servicio Público de Empleo Estatal de créditos destinados a programas de fomento de empleo
2017;G;4;48;482/19104;;;Prestaciones sociales
2017;G;4;48;482/20102;;;Para formación de funcionarios y colaboración con oficinas iberoamericanas de la Propiedad Industrial
2017;G;4;48;482/23001;;;Organizaciones Profesionales Agrarias y otras Entidades Asociativas.
2017;G;4;48;482/23014;;;Subvenciones al sector comercial pesquero para ampliación de mercados.
2017;G;4;48;482/23017;;;Ayudas a la acuicultura
2017;G;4;48;482/23101;;;Sociedad Española de Ornitología/BirdLIFE, para fomentar su participación en el Consejo de la Red de Parques Nacionales.
2017;G;4;48;482/23103;;;Sociedad Española de Presas y Embalses SEPREM
2017;G;4;48;482/23107;;;Becas a estudiantes de ingeniería en prácticas
2017;G;4;48;482/23108;;;Comité Español de Grandes Presas
2017;G;4;48;482/23113;;;Organizaciones Profesionales Agrarias y otras Entidades Asociativas.
2017;G;4;48;482/25002;;;Indemnizaciones
2017;G;4;48;482/25004;;;A la Fundación Manuel Giménez Abad
2017;G;4;48;482/25103;;;Becas
2017;G;4;48;482/26017;;;Para programas de personas con discapacidad
2017;G;4;48;482/26018;;;Programas desarrollados por ONGs de ámbito estatal, financiados a través del Fondo creado por la Ley 17/2003
2017;G;4;48;482/26022;;;Convenio con la Federación Española de Municipios y Provincias
2017;G;4;48;482/26101;;;Convenio con la Federación Española de Municipios y Provincias
2017;G;4;48;482/26106;;;A la Fundación (CNSE) para el Centro de Normalización Lingüística de la Lengua de Signos Española
2017;G;4;48;482/26107;;;Programa de emprendimiento y fomento del liderazgo de las mujeres en los órganos de decisión de las sociedades del sector agroalimentario e intercambio de buenas prácticas
2017;G;4;48;482/26109;;;Ayudas y subvenciones para impulsar, orientar y desarrollar, etc, colaborando con las asociaciones de consumidores, cooperativas de consumo, instituciones públicas y privadas y personas físicas de ámbito nacional sobre asuntos de política de consumo y de los consumidores, educación para el consumo y didáctica sobre la educación para el consumo
2017;G;4;48;482/26401;;;A la Fundación Casa del Corazón para la gestión y mantenimiento de los Registros Nacionales de Marcapasos y Desfribriladores Implantables
2017;G;4;48;482/27009;;;Acuerdos sectoriales a la exportación
2017;G;4;48;482/27103;;;Cuotas asociaciones
2017;G;4;48;482/27104;;;Cuotas organismos nacionales
2017;G;4;48;482/27109;;;Gastos derivados de la formación de becarios
2017;G;4;48;482/27302;;;Indemnización a expresidentes y exconsejeros
2017;G;4;48;482/60001;;;Incapacidad temporal
2017;G;4;48;483/08001;;;A Asociaciones Judiciales
2017;G;4;48;483/12001;;;Becas Escuela Diplomática
2017;G;4;48;483/13002;;;Al Consejo General de la Abogacía Española como aportación del Estado para indemnizar a los abogados en los asuntos de asistencia jurídica gratuita
2017;G;4;48;483/13102;;;Asistencia Social
2017;G;4;48;483/14012;;;Alumnos de academias
2017;G;4;48;483/14113;;;Asistencia Social
2017;G;4;48;483/15102;;;Becas Fulbright.
2017;G;4;48;483/15106;;;Asistencia Social
2017;G;4;48;483/16001;;;Indemnizaciones, ayudas y subvenciones derivadas de la Ley 29/2011, de 22 de septiembre, de Reconocimiento y Protección Integral a las Víctimas del Terrorismo y artículo 11 del Real Decreto 671/2013, de 6 de septiembre, por el que se aprueba el Reglamento de la Ley 29/2011
2017;G;4;48;483/16002;;;"A ""Ayuda a Niños y Adolescentes en Riesgo"" (Fundación ANAR)"
2017;G;4;48;483/16003;;;A Organizaciones Sindicales del Cuerpo Nacional de Policía, en proporción a su representatividad
2017;G;4;48;483/16004;;;A asociaciones profesionales de la Guardia Civil
2017;G;4;48;483/16005;;;Cofinanciación de redes de recursos para atención de personas sometidas a medidas de seguridad, suspensión de la pena y reglas de conducta del Código Penal, así como a enfermos de SIDA e integración social de niños en Unidades de Madres y programa de violencia de género
2017;G;4;48;483/17018;;;Subvención al Observatorio del Ebro
2017;G;4;48;483/17032;;;ANAVE por los costes de formación a alumnos embarcados en prácticas
2017;G;4;48;483/18001;;;Comisión Permanente de la Asociación de Academias de la Lengua Española
2017;G;4;48;483/18005;;;Para diversas actuaciones
2017;G;4;48;483/18006;;;Para financiar medidas de apoyo institucional a los sindicatos del sector
2017;G;4;48;483/18102;;;Para financiar el Plan Ejecutivo de cooperación e intercambio con la República Popular China
2017;G;4;48;483/18106;;;A federaciones deportivas españolas y Comité Olímpico Español
2017;G;4;48;483/18107;;;Apoyo a la actividad teatral y circense de ámbito nacional de entidades sin fines de lucro
